{
  "function_key": "momi.communications.capture_human_message.v1",
  "contract_version": 1,
  "purpose": "Capture one committed OpenWebUI human message into immutable evidence.",
  "owner_service": "communications-archive",
  "function_type": "ingest",
  "capability": "ingest",
  "boundary": "momi_internal",
  "runtime": "supabase_edge",
  "route_path": "/functions/v1/momi-communications-capture-human-message-v1",
  "authentication_policy_key": "momi.openwebui.human_relay_credential.v1",
  "entrypoint": "index.ts",
  "input_schema": "contracts/input.schema.json",
  "output_schema": "contracts/output.schema.json",
  "idempotency_policy_key": "momi.communications.openwebui_message_identity.v1",
  "required_capabilities": ["database_write"],
  "declared_side_effects": ["stores_archive_item"]
}
