{
  "function_key": "momi.orders.alert.evaluate.v1",
  "contract_version": 1,
  "purpose": "Evaluate one owned order document against alert configuration and create durable delivery work.",
  "owner_service": "order-alerting",
  "function_type": "action",
  "capability": "decide",
  "boundary": "momi_internal",
  "runtime": "supabase_edge",
  "route_path": "/functions/v1/momi-order-alert-worker-v1",
  "authentication_policy_key": "durable.work_token.v1",
  "entrypoint": "index.ts",
  "input_schema": "contracts/input.schema.json",
  "output_schema": "contracts/output.schema.json",
  "idempotency_policy_key": "momi.alert.candidate.v1",
  "required_capabilities": [
    "database_read",
    "database_write",
    "momi_order_api_http"
  ],
  "declared_side_effects": [
    "records_order_api_invocation_attempt",
    "claims_order_alert_candidate",
    "completes_order_api_invocation_work",
    "queues_configured_delivery_work"
  ]
}
