{
  "function_key": "momi.orders.get_by_id.v1",
  "contract_version": 1,
  "purpose": "Read one canonical Dough Monster order by its stable entity ID.",
  "owner_service": "warehouse-read-api",
  "function_type": "read",
  "capability": "read",
  "boundary": "momi_internal",
  "runtime": "supabase_edge",
  "route_path": "/functions/v1/momi-orders-get-by-id-v1",
  "authentication_policy_key": "durable.read_capability.v1",
  "entrypoint": "index.ts",
  "input_schema": "contracts/input.schema.json",
  "output_schema": "contracts/output.schema.json",
  "required_capabilities": ["database_read", "database_write"],
  "declared_side_effects": ["consumes_read_capability"]
}
