{
  "function_key": "momi.communications.evaluate_item.v1",
  "contract_version": 1,
  "purpose": "Evaluate one durable communication archive item with a configured model.",
  "owner_service": "communications-evaluation",
  "function_type": "coordinator",
  "capability": "decide",
  "boundary": "momi_internal",
  "runtime": "supabase_edge",
  "route_path": "/functions/v1/momi-communications-evaluate-item-v1",
  "authentication_policy_key": "durable.work_token.v1",
  "entrypoint": "index.ts",
  "input_schema": "contracts/input.schema.json",
  "output_schema": "contracts/output.schema.json",
  "timeout_policy_key": "momi.communications.evaluator_lease.v1",
  "retry_policy_key": "momi.communications.evaluator_backoff.v1",
  "idempotency_policy_key": "momi.communications.evaluation_job.v1",
  "required_capabilities": ["database_read", "database_write", "model_inference"],
  "declared_side_effects": [
    "claims_evaluation_lease",
    "calls_configured_model",
    "stores_communication_evaluation",
    "stores_derived_records",
    "records_evaluation_audit"
  ]
}
