{
  "function_key": "momi.model_execution.complete_background.v1",
  "contract_version": 1,
  "purpose": "Reconcile one terminal background model response and notify its owning caller.",
  "owner_service": "model-execution-gateway",
  "function_type": "coordinator",
  "capability": "deliver",
  "boundary": "momi_internal",
  "runtime": "supabase_edge",
  "route_path": "/functions/v1/momi-model-execution-completion-worker-v1",
  "authentication_policy_key": "durable.work_token.v1",
  "entrypoint": "index.ts",
  "input_schema": "contracts/input.schema.json",
  "output_schema": "contracts/output.schema.json",
  "timeout_policy_key": "momi.model_execution.completion_lease.v1",
  "retry_policy_key": "momi.model_execution.completion_backoff.v1",
  "idempotency_policy_key": "model_execution.completion_work.v1",
  "required_capabilities": ["database_read", "database_write", "model_inference"],
  "declared_side_effects": [
    "retrieves_terminal_provider_response",
    "records_content_free_provider_metadata",
    "notifies_owning_caller"
  ]
}
