{
  "function_key": "momi.toast_orders.get_by_id.v1",
  "contract_version": 1,
  "purpose": "Read one fully hydrated Toast order through the owned MoMi API contract.",
  "owner_service": "momi-toast-order-api",
  "function_type": "read",
  "capability": "read",
  "boundary": "momi_internal",
  "runtime": "supabase_edge",
  "route_path": "/functions/v1/momi-toast-orders-get-by-id-v1",
  "authentication_policy_key": "durable.work_token.v1",
  "entrypoint": "index.ts",
  "input_schema": "contracts/input.schema.json",
  "output_schema": "contracts/output.schema.json",
  "required_capabilities": [
    "database_read"
  ],
  "declared_side_effects": []
}
